54602 ecr 4009027624], length 384
01:53:20.349997 IP 162.243.188.66.26411 > 165.22.230.30.22: Flags [.], ack 104864, win 5875, options [nop,nop,TS val 4009027726 ecr 1688354602], length 0
01:53:20.438749 IP 165.22.230.30.22 > 162.243.188.66.26411: Flags [P.], seq 104864:105248, ack 1, win 501, options [nop,nop,TS val 1688354706 ecr 4009027726], length 384
01:53:20.454942 IP 162.243.188.66.26411 > 165.22.230.30.22: Flags [.], ack 105248, win 5875, options [nop,nop,TS val 4009027831 ecr 1688354706], length 0
01:53:20.542743 IP 165.22.230.30.22 > 162.243.188.66.26411: Flags [P.], seq 105248:105632, ack 1, win 501, options [nop,nop,TS val 1688354810 ecr 4009027831], length 384
01:53:20.557609 IP 162.243.188.66.26411 > 165.22.230.30.22: Flags [.], ack 105632, win 5875, options [nop,nop,TS val 4009027934 ecr 1688354810], length 0
01:53:20.646614 IP 165.22.230.30.22 > 162.243.188.66.26411: Flags [P.], seq 105632:106016, ack 1, win 501, options [nop,nop,TS val 1688354914 ecr 4009027934], length 384
01:53:20.661746 IP 162.243.188.66.26411 > 165.22.230.30.22: Flags [.], ack 106016, win 5875, options [nop,nop,TS val 4009028038 ecr 1688354914], length 0
01:53:20.750721 IP 165.22.230.30.22 > 162.243.188.66.26411: Flags [P.], seq 106016:106400, ack 1, win 501, options [nop,nop,TS val 1688355018 ecr 4009028038], length 384
01:53:20.765471 IP 162.243.188.66.26411 > 165.22.230.30.22: Flags [.], ack 106400, win 5875, options [nop,nop,TS val 4009028141 ecr 1688355018], length 0
01:53:20.854696 IP 165.22.230.30.22 > 162.243.188.66.26411: Flags [P.], seq 106400:106784, ack 1, win 501, options [nop,nop,TS val 1688355122 ecr 4009028141], length 384
01:53:20.870274 IP 162.243.188.66.26411 > 165.22.230.30.22: Flags [.], ack 106784, win 5875, options [nop,nop,TS val 4009028246 ecr 1688355122], length 0
01:53:20.870397 IP 165.22.230.30.80 > 40.68.127.64.62311: Flags [S.], seq 107631290, ack 2755508031, win 64240, options [mss 1460,nop,nop,sackOK,nop,wscale 7], length 0
01:53:20.958704 IP 165.22.230.30.22 > 162.243.188.66.26411: Flags [P.], seq 106784:107344, ack 1, win 501, options [nop,nop,TS val 1688355226 ecr 4009028246], length 560
01:53:20.974783 IP 162.243.188.66.26411 > 165.22.230.30.22: Flags [.], ack 107344, win 5875, options [nop,nop,TS val 4009028351 ecr 1688355226], length 0
01:53:21.062715 IP 165.22.230.30.22 > 162.243.188.66.26411: Flags [P.], seq 107344:107728, ack 1, win 501, options [nop,nop,TS val 1688355330 ecr 4009028351], length 384
01:53:21.077517 IP 109.206.236.111.57574 > 165.22.230.30.22: Flags [S], seq 680350186, win 32120, options [mss 1460,sackOK,TS val 431001931 ecr 0,nop,wscale 7], length 0
01:53:21.077626 IP 165.22.230.30.22 > 109.206.236.111.57574: Flags [S.], seq 3486461679, ack 680350187, win 65160, options [mss 1460,sackOK,TS val 2521177160 ecr 431001931,nop,wscale 7], length 0
01:53:21.077650 IP 162.243.188.66.26411 > 165.22.230.30.22: Flags [.], ack 107728, win 5875, options [nop,nop,TS val 4009028454 ecr 1688355330], length 0
01:53:21.166749 IP 165.22.230.30.22 > 162.243.188.66.26411: Flags [P.], seq 107728:108480, ack 1, win 501, options [nop,nop,TS val 1688355434 ecr 4009028454], length 752
01:53:21.185966 IP 162.243.188.66.26411 > 165.22.230.30.22: Flags [.], ack 108480, win 5875, options [nop,nop,TS val 4009028562 ecr 1688355434], length 0
01:53:21.194526 IP 109.206.236.111.57574 > 165.22.230.30.22: Flags [.], ack 1, win 251, options [nop,nop,TS val 431002047 ecr 2521177160], length 0
01:53:21.198752 IP 109.206.236.111.57574 > 165.22.230.30.22: Flags [P.], seq 1:13, ack 1, win 251, options [nop,nop,TS val 431002053 ecr 2521177160], length 12: SSH: SSH-2.0-Go
01:53:21.198801 IP 165.22.230.30.22 > 109.206.236.111.57574: Flags [.], ack 13, win 509, options [nop,nop,TS val 2521177281 ecr 431002053], length 0
01:53:21.207113 IP 95.173.217.163.50054 > 165.22.230.30.50002: Flags [S], seq 1893193545, win 64240, options [mss 1460,sackOK,TS val 4239087872 ecr 0,nop,wscale 8], length 0
01:53:21.208110 IP 165.22.230.30.22 > 109.206.236.111.57574: Flags [P.], seq 1:43, ack 13, win 509, options [nop,nop,TS val 2521177290 ecr 431002053], length 42: SSH: SSH-2.0-OpenSSH_8.9p1 Ubuntu-3ubuntu0.10
01:53:21.270744 IP 165.22.230.30.22 > 162.243.188.66.26411: Flags [P.], seq 108480:109728, ack 1, win 501, options [nop,nop,TS val 1688355538 ecr 4009028562], length 1248
01:53:21.323299 IP 109.206.236.111.57574 > 165.22.230.30.22: Flags [.], ack 43, win 251, options [nop,nop,TS val 431002178 ecr 2521177290], length 0
01:53:21.323361 IP 165.22.230.30.22 > 109.206.236.111.57574: Flags [P.], seq 43:1155, ack 13, win 509, options [nop,nop,TS val 2521177405 ecr 431002178], length 1112
01:53:21.324908 IP 162.243.188.66.26411 > 165.22.230.30.22: Flags [.], ack 109728, win 5875, options [nop,nop,TS val 4009028701 ecr 1688355538], length 0
01:53:21.349631 IP 109.206.236.111.57574 > 165.22.230.30.22: Flags [P.], seq 13:1133, ack 43, win 251, options [nop,nop,TS val 431002204 ecr 2521177290], length 1120
01:53:21.374801 IP 165.22.230.30.22 > 162.243.188.66.26411: Flags [P.], seq 109728:110592, ack 1, win 501, options [nop,nop,TS val 1688355642 ecr 4009028701], length 864
01:53:21.389246 IP 162.243.188.66.26411 > 165.22.230.30.22: Flags [.], ack 110592, win 5875, options [nop,nop,TS val 4009028765 ecr 1688355642], length 0
01:53:21.390430 IP 165.22.230.30.22 > 109.206.236.111.57574: Flags [.], ack 1133, win 501, options [nop,nop,TS val 2521177473 ecr 431002204], length 0
01:53:21.438799 IP 109.206.236.111.57574 > 165.22.230.30.22: Flags [P.], seq 1133:1181, ack 1155, win 249, options [nop,nop,TS val 431002293 ecr 2521177405], length 48
01:53:21.438886 IP 165.22.230.30.22 > 109.206.236.111.57574: Flags [.], ack 1181, win 501, options [nop,nop,TS val 2521177521 ecr 431002293], length 0
01:53:21.444116 IP 165.22.230.30.22 > 109.206.236.111.57574: Flags [P.], seq 1155:1759, ack 1181, win 501, options [nop,nop,TS val 2521177526 ecr 431002293], length 604
01:53:21.478731 IP 165.22.230.30.22 > 162.243.188.66.26411: Flags [P.], seq 110592:111616, ack 1, win 501, options [nop,nop,TS val 1688355746 ecr 4009028765], length 1024
01:53:21.497963 IP 162.243.188.66.26411 > 165.22.230.30.22: Flags [.], ack 111616, win 5875, options [nop,nop,TS val 4009028874 ecr 1688355746], length 0
01:53:21.573408 IP 109.206.236.111.57574 > 165.22.230.30.22: Flags [P.], seq 1181:1197, ack 1759, win 249, options [nop,nop,TS val 431002426 ecr 2521177526], length 16
01:53:21.573408 IP 109.206.236.111.57574 > 165.22.230.30.22: Flags [P.], seq 1197:1249, ack 1759, win 249, options [nop,nop,TS val 431002426 ecr 2521177526], length 52
01:53:21.573573 IP 165.22.230.30.22 > 109.206.236.111.57574: Flags [.], ack 1249, win 501, options [nop,nop,TS val 2521177656 ecr 431002426], length 0
01:53:21.573688 IP 165.22.230.30.22 > 109.206.236.111.57574: Flags [P.], seq 1759:1811, ack 1249, win 501, options [nop,nop,TS val 2521177656 ecr 431002426], length 52
01:53:21.582679 IP 165.22.230.30.22 > 162.243.188.66.26411: Flags [P.], seq 111616:112656, ack 1, win 501, options [nop,nop,TS val 1688355850 ecr 4009028874], length 1040
01:53:21.600100 IP 162.243.188.66.26411 > 165.22.230.30.22: Flags [.], ack 112656, win 5875, options [nop,nop,TS val 4009028976 ecr 1688355850], length 0
01:53:21.686688 IP 165.22.230.30.22 > 162.243.188.66.26411: Flags [P.], seq 112656:113040, ack 1, win 501, options [nop,nop,TS val 1688355954 ecr 4009028976], length 384
01:53:21.702016 IP 162.243.188.66.26411 > 165.22.230.30.22: Flags [.], ack 113040, win 5875, options [nop,nop,TS val 4009029078 ecr 1688355954], length 0
01:53:21.728094 IP 109.206.236.111.57574 > 165.22.230.30.22: Flags [.], ack 1811, win 249, options [nop,nop,TS val 431002583 ecr 2521177656], length 0
01:53:21.790648 IP 165.22.230.30.22 > 162.243.188.66.26411: Flags [P.], seq 113040:113568, ack 1, win 501, options [nop,nop,TS val 1688356058 ecr 4009029078], length 528
01:53:21.805917 IP 162.243.188.66.26411 > 165.22.230.30.22: Flags [.], ack 113568, win 5875, options [nop,nop,TS val 4009029182 ecr 1688356058], length 0
01:53:21.894659 IP 165.22.230.30.22 > 162.243.188.66.26411: Flags [P.], seq 113568:113952, ack 1, win 501, options [nop,nop,TS val 1688356162 ecr 4009029182], length 384
01:53:21.907588 IP 162.243.188.66.26411 > 165.22.230.30.22: Flags [.], ack 113952, win 5875, options [nop,nop,TS val 4009029284 ecr 1688356162], length 0
01:53:21.912923 IP 109.206.236.111.57574 > 165.22.230.30.22: Flags [P.], seq 1249:1317, ack 1811, win 249, options [nop,nop,TS val 431002767 ecr 2521177656], length 68
01:53:21.920268 IP 165.22.230.30.22 > 109.206.236.111.57574: Flags [P.], seq 1811:1863, ack 1317, win 501, options [nop,nop,TS val 2521178002 ecr 431002767], length 52
01:53:21.998691 IP 165.22.230.30.22 > 162.243.188.66.26411: Flags [P.], seq 113952:114672, ack 1, win 501, options [nop,nop,TS val 1688356266 ecr 4009029284], length 720
01:53:22.013868 IP 162.243.188.66.26411 > 165.22.230.30.22: Flags [.], ack 114672, win 5875, options [nop,nop,TS val 4009029390 ecr 1688356266], length 0
01:53:22.034469 IP 109.206.236.111.57574 > 165.22.230.30.22: Flags [.], ack 1863, win 249, options [nop,nop,TS val 431002889 ecr 2521178002], length 0
01:53:22.102633 IP 165.22.230.30.22 > 162.243.188.66.26411: Flags [P.], seq 114672:115200, ack 1, win 501, options [nop,nop,TS val 1688356370 ecr 4009029390], length 528
01:53:22.118700 IP 162.243.188.66.26411 > 165.22.230.30.22: Flags [.], ack 115200, win 5875, options [nop,nop,TS val 4009029495 ecr 1688356370], length 0
01:53:22.206668 IP 165.22.230.30.22 > 162.243.188.66.26411: Flags [P.], seq 115200:115584, ack 1, win 501, options [nop,nop,TS val 1688356474 ecr 4009029495], length 384
01:53:22.220277 IP 162.243.188.66.26411 > 165.22.230.30.22: Flags [.], ack 115584, win 5875, options [nop,nop,TS val 4009029596 ecr 1688356474], length 0
01:53:22.244411 IP 109.206.236.111.57574 > 165.22.230.30.22: Flags [P.], seq 1317:1401, ack 1863, win 249, options [nop,nop,TS val 431003099 ecr 2521178002], length 84
01:53:22.286480 IP 165.22.230.30.22 > 109.206.236.111.57574: Flags [.], ack 1401, win 501, options [nop,nop,TS val 2521178369 ecr 431003099], length 0
01:53:22.310719 IP 165.22.230.30.22 > 162.243.188.66.26411: Flags [P.], seq 115584:116288, ack 1, win 501, options [nop,nop,TS val 1688356578 ecr 4009029596], length 704
01:53:22.329148 IP 162.243.188.66.26411 > 165.22.230.30.22: Flags [.], ack 116288, win 5875, options [nop,nop,TS val 4009029705 ecr 1688356578], length 0
01:53:22.414642 IP 165.22.230.30.22 > 162.243.188.66.26411: Flags [P.], seq 116288:116672, ack 1, win 501, options [nop,nop,TS val 1688356682 ecr 4009029705], length 384
01:53:22.430390 IP 162.243.188.66.26411 > 165.22.230.30.22: Flags [.], ack 116672, win 5875, options [nop,nop,TS val 4009029806 ecr 1688356682], length 0
01:53:22.518622 IP 165.22.230.30.22 > 162.243.188.66.26411: Flags [P.], seq 116672:117056, ack 1, win 501, options [nop,nop,TS val 1688356786 ecr 4009029806], length 384
01:53:22.533688 IP 162.243.188.66.26411 > 165.22.230.30.22: Flags [.], ack 117056, win 5875, options [nop,nop,TS val 4009029910 ecr 1688356786], length 0
01:53:22.622649 IP 165.22.230.30.22 > 162.243.188.66.26411: Flags [P.], seq 117056:117440, ack 1, win 501, options [nop,nop,TS val 1688356890 ecr 4009029910], length 384
01:53:22.638469 IP 162.243.188.66.26411 > 165.22.230.30.22: Flags [.], ack 117440, win 5875, options [nop,nop,TS val 4009030015 ecr 1688356890], length 0
01:53:22.726679 IP 165.22.230.30.22 > 162.243.188.66.26411: Flags [P.], seq 117440:117824, ack 1, win 501, options [nop,nop,TS val 1688356994 ecr 4009030015], length 384
01:53:22.741790 IP 162.243.188.66.26411 > 165.22.230.30.22: Flags [.], ack 117824, win 5875, options [nop,nop,TS val 4009030118 ecr 1688356994], length 0
01:53:22.830688 IP 165.22.230.30.22 > 162.243.188.66.26411: Flags [P.], seq 117824:118208, ack 1, win 501, options [nop,nop,TS val 1688357098 ecr 4009030118], length 384
01:53:22.844823 IP 162.243.188.66.26411 > 165.22.230.30.22: Flags [.], ack 118208, win 5875, options [nop,nop,TS val 4009030221 ecr 1688357098], length 0
01:53:22.934619 IP 165.22.230.30.22 > 162.243.188.66.26411: Flags [P.], seq 118208:118592, ack 1, win 501, options [nop,nop,TS val 1688357202 ecr 4009030221], length 384
01:53:22.949059 IP 162.243.188.66.26411 > 165.22.230.30.22: Flags [.], ack 118592, win 5875, options [nop,nop,TS val 4009030325 ecr 1688357202], length 0
01:53:23.038676 IP 165.22.230.30.22 > 162.243.188.66.26411: Flags [P.], seq 118592:118976, ack 1, win 501, options [nop,nop,TS val 1688357306 ecr 4009030325], length 384
01:53:23.051171 IP 162.243.188.66.26411 > 165.22.230.30.22: Flags [.], ack 118976, win 5875, options [nop,nop,TS val 4009030427 ecr 1688357306], length 0
01:53:23.142714 IP 165.22.230.30.22 > 162.243.188.66.26411: Flags [P.], seq 118976:119360, ack 1, win 501, options [nop,nop,TS val 1688357410 ecr 4009030427], length 384
01:53:23.156772 IP 162.243.188.66.26411 > 165.22.230.30.22: Flags [.], ack 119360, win 5875, options [nop,nop,TS val 4009030533 ecr 1688357410], length 0
01:53:23.227076 IP 95.173.217.163.50054 > 165.22.230.30.50002: Flags [S], seq 1893193545, win 64240, options [mss 1460,sackOK,TS val 4239089892 ecr 0,nop,wscale 8], length 0
01:53:23.246677 IP 165.22.230.30.22 > 162.243.188.66.26411: Flags [P.], seq 119360:119920, ack 1, win 501, options [nop,nop,TS val 1688357514 ecr 4009030533], length 560
01:53:23.262022 IP 162.243.188.66.26411 > 165.22.230.30.22: Flags [.], ack 119920, win 5875, options [nop,nop,TS val 4009030638 ecr 1688357514], length 0
^C
583 packets captured
589 packets received by filter