root@comp3134-Winter2025:~# tcpdump -c 5 -i eth0
tcpdump: verbose output suppressed, use -v[v]... for full protocol decode
listening on eth0, link-type EN10MB (Ethernet), snapshot length 262144 bytes
01:43:47.419901 IP comp3134-Winter2025.ssh > 162.243.188.66.26411: Flags [P.], seq 2813187553:2813187617, ack 479426382, win 501, options [nop,nop,TS val 1687781687 ecr 4008454791], length 64
01:43:47.420630 IP comp3134-Winter2025.ssh > 162.243.188.66.26411: Flags [P.], seq 64:192, ack 1, win 501, options [nop,nop,TS val 1687781688 ecr 4008454791], length 128
01:43:47.420694 IP comp3134-Winter2025.ssh > 162.243.188.66.26411: Flags [P.], seq 192:256, ack 1, win 501, options [nop,nop,TS val 1687781688 ecr 4008454791], length 64
01:43:47.420744 IP comp3134-Winter2025.ssh > 162.243.188.66.26411: Flags [P.], seq 256:336, ack 1, win 501, options [nop,nop,TS val 1687781688 ecr 4008454791], length 80
01:43:47.420777 IP comp3134-Winter2025.ssh > 162.243.188.66.26411: Flags [P.], seq 336:416, ack 1, win 501, options [nop,nop,TS val 1687781688 ecr 4008454791], length 80
5 packets captured
43 packets received by filter
0 packets dropped by kernel